[
  {
    "id": "CTL-ACC-01",
    "theme": "accountability",
    "title_en": "Approved AI policy",
    "title_ar": "سياسة معتمدة للذكاء الاصطناعي",
    "control_text_en": "Adopt an AI policy approved by senior leadership that states the organisation's principles, risk appetite and approval rules for AI, and review it at least once a year.",
    "control_text_ar": "اعتماد سياسة للذكاء الاصطناعي من الإدارة العليا تحدد مبادئ الجهة ومستوى المخاطر المقبول وقواعد الموافقة على الاستخدامات، مع مراجعتها سنويًا على الأقل.",
    "applies_when": {
      "min_tier": "little",
      "ai_types": [],
      "data": []
    },
    "refs": {
      "uae_charter": [],
      "uae_gov_code": [],
      "dubai_ethics": [
        "Accountability"
      ],
      "sdaia": [
        "Accountability & Responsibility"
      ],
      "iso42001": [
        "A.2.2",
        "A.2.4"
      ],
      "nist_ai_rmf": [
        "GOVERN 1.2",
        "GOVERN 2.3"
      ],
      "eu_ai_act": []
    },
    "source_urls": [
      "https://www.digitaldubai.ae/docs/default-source/ai-principles-resources/ai-ethics.pdf",
      "https://sdaia.gov.sa/en/SDAIA/about/Documents/ai-principles.pdf",
      "https://airc.nist.gov/docs/NIST_AI_RMF_to_ISO_IEC_42001_Crosswalk.pdf",
      "https://nvlpubs.nist.gov/nistpubs/ai/NIST.AI.100-1.pdf"
    ],
    "verified": true,
    "verified_on": "2026-09-27",
    "notes": "ISO/IEC 42001 numbers confirmed via the NIST-hosted crosswalk, which cites the FDIS Annex B guidance numbering that parallels Annex A."
  },
  {
    "id": "CTL-ACC-02",
    "theme": "accountability",
    "title_en": "Named accountable owner",
    "title_ar": "مالك مسؤول محدد بالاسم",
    "control_text_en": "Assign every AI use case a named business owner who is accountable for its outcomes, and record the technical, data and risk contacts alongside them.",
    "control_text_ar": "تعيين مالك أعمال محدد بالاسم لكل حالة استخدام يتحمّل المسؤولية عن نتائجها، وتوثيق جهات الاتصال التقنية ومسؤولي البيانات والمخاطر المرتبطين بها.",
    "applies_when": {
      "min_tier": "little",
      "ai_types": [],
      "data": []
    },
    "refs": {
      "uae_charter": [
        "Governance and accountability"
      ],
      "uae_gov_code": [
        "Agentic Reference p.9"
      ],
      "dubai_ethics": [
        "Accountability"
      ],
      "sdaia": [
        "Accountability & Responsibility"
      ],
      "iso42001": [
        "A.3.2"
      ],
      "nist_ai_rmf": [
        "GOVERN 2.1"
      ],
      "eu_ai_act": []
    },
    "source_urls": [
      "https://uaelegislation.gov.ae/en/policy/details/the-uae-charter-for-the-development-and-use-of-artificial-intelligence",
      "https://www.digitaldubai.ae/docs/default-source/ai-principles-resources/ai-ethics.pdf",
      "https://sdaia.gov.sa/en/SDAIA/about/Documents/ai-principles.pdf",
      "https://airc.nist.gov/docs/NIST_AI_RMF_to_ISO_IEC_42001_Crosswalk.pdf",
      "https://nvlpubs.nist.gov/nistpubs/ai/NIST.AI.100-1.pdf"
    ],
    "verified": true,
    "verified_on": "2026-10-15",
    "notes": "UAE Charter principle name(s) Governance and accountability confirmed on 2026-10-15 against the official Charter page on the UAE Legislation portal (issued 10 Jun 2024), read in a browser because scripted fetches are blocked. All other refs in this row were confirmed on 2026-09-27. p.9 of the UAE Agentic AI National Reference (July 2026) confirmed against the document text; no public URL known, so it is recorded here rather than in source_urls."
  },
  {
    "id": "CTL-ACC-03",
    "theme": "accountability",
    "title_en": "AI use-case register",
    "title_ar": "سجل حالات استخدام الذكاء الاصطناعي",
    "control_text_en": "Keep a single register of all AI systems in use or in development, with owner, purpose, data used, risk tier and status, and keep it current.",
    "control_text_ar": "الاحتفاظ بسجل موحّد لجميع أنظمة الذكاء الاصطناعي المستخدمة أو قيد التطوير، يتضمن المالك والغرض والبيانات المستخدمة ومستوى المخاطر والحالة، وتحديثه باستمرار.",
    "applies_when": {
      "min_tier": "little",
      "ai_types": [],
      "data": []
    },
    "refs": {
      "uae_charter": [],
      "uae_gov_code": [],
      "dubai_ethics": [],
      "sdaia": [
        "Accountability & Responsibility"
      ],
      "iso42001": [
        "A.4.2"
      ],
      "nist_ai_rmf": [
        "GOVERN 1.6"
      ],
      "eu_ai_act": []
    },
    "source_urls": [
      "https://sdaia.gov.sa/en/SDAIA/about/Documents/ai-principles.pdf",
      "https://airc.nist.gov/docs/NIST_AI_RMF_to_ISO_IEC_42001_Crosswalk.pdf",
      "https://nvlpubs.nist.gov/nistpubs/ai/NIST.AI.100-1.pdf"
    ],
    "verified": true,
    "verified_on": "2026-09-27",
    "notes": "ISO/IEC 42001 numbers confirmed via the NIST-hosted crosswalk, which cites the FDIS Annex B guidance numbering that parallels Annex A."
  },
  {
    "id": "CTL-ACC-04",
    "theme": "accountability",
    "title_en": "Impact assessment before approval",
    "title_ar": "تقييم الأثر قبل الموافقة",
    "control_text_en": "Before approving a use case, assess its likely impact on individuals, groups and the organisation, record the result, and repeat the assessment when the system changes materially.",
    "control_text_ar": "إجراء تقييم للأثر المحتمل على الأفراد والفئات والجهة قبل الموافقة على حالة الاستخدام، وتوثيق النتائج، وإعادة التقييم عند حدوث تغيير جوهري في النظام.",
    "applies_when": {
      "min_tier": "limited",
      "ai_types": [],
      "data": []
    },
    "refs": {
      "uae_charter": [],
      "uae_gov_code": [],
      "dubai_ethics": [
        "Accountability"
      ],
      "sdaia": [
        "Accountability & Responsibility"
      ],
      "iso42001": [
        "A.5.2",
        "A.5.3",
        "A.5.4"
      ],
      "nist_ai_rmf": [
        "MAP 1.1",
        "MAP 5.1"
      ],
      "eu_ai_act": [
        "Art. 9",
        "Art. 27"
      ]
    },
    "source_urls": [
      "https://www.digitaldubai.ae/docs/default-source/ai-principles-resources/ai-ethics.pdf",
      "https://sdaia.gov.sa/en/SDAIA/about/Documents/ai-principles.pdf",
      "https://airc.nist.gov/docs/NIST_AI_RMF_to_ISO_IEC_42001_Crosswalk.pdf",
      "https://nvlpubs.nist.gov/nistpubs/ai/NIST.AI.100-1.pdf",
      "https://eur-lex.europa.eu/legal-content/EN/TXT/HTML/?uri=OJ:L_202401689"
    ],
    "verified": true,
    "verified_on": "2026-09-27",
    "notes": "ISO/IEC 42001 numbers confirmed via the NIST-hosted crosswalk, which cites the FDIS Annex B guidance numbering that parallels Annex A."
  },
  {
    "id": "CTL-ACC-05",
    "theme": "accountability",
    "title_en": "Go/no-go decision gate",
    "title_ar": "بوابة قرار الإطلاق",
    "control_text_en": "Require a documented go/no-go decision by an authorised committee or executive before a high-risk system goes live, based on test results and the residual risk.",
    "control_text_ar": "اشتراط قرار موثّق بالإطلاق أو عدمه من لجنة أو مسؤول مخوّل قبل تشغيل أي نظام عالي المخاطر، بناءً على نتائج الاختبار والمخاطر المتبقية.",
    "applies_when": {
      "min_tier": "high",
      "ai_types": [],
      "data": []
    },
    "refs": {
      "uae_charter": [],
      "uae_gov_code": [
        "Code 2.1",
        "Code 8.8",
        "Agentic Guide §06"
      ],
      "dubai_ethics": [],
      "sdaia": [
        "Accountability & Responsibility",
        "Reliability & Safety"
      ],
      "iso42001": [
        "A.6.2.5"
      ],
      "nist_ai_rmf": [
        "MANAGE 1.1",
        "GOVERN 2.3"
      ],
      "eu_ai_act": []
    },
    "source_urls": [
      "https://sdaia.gov.sa/en/SDAIA/about/Documents/ai-principles.pdf",
      "https://airc.nist.gov/docs/NIST_AI_RMF_to_ISO_IEC_42001_Crosswalk.pdf",
      "https://nvlpubs.nist.gov/nistpubs/ai/NIST.AI.100-1.pdf",
      "https://uaecabinet.ae/en/news/under-directives-of-uae-president-and-in-world-first-mohammed-bin-rashid-reveals-new-uae-government-framework-to-deploy-agentic-ai-across-50-of-government-sectors-operations-within-two-years",
      "https://uaemodel.egsep.ae/agentic_ai_guide_website.html"
    ],
    "verified": true,
    "verified_on": "2026-09-27",
    "notes": "ISO/IEC 42001 numbers confirmed via the NIST-hosted crosswalk, which cites the FDIS Annex B guidance numbering that parallels Annex A."
  },
  {
    "id": "CTL-ACC-06",
    "theme": "accountability",
    "title_en": "Third-party AI due diligence",
    "title_ar": "العناية الواجبة تجاه موردي الذكاء الاصطناعي",
    "control_text_en": "Before buying or integrating a third-party model or AI service, check its documentation, data handling and known limitations, and set out responsibilities for oversight, incidents and updates in the contract.",
    "control_text_ar": "قبل شراء نموذج أو خدمة ذكاء اصطناعي من طرف ثالث أو دمجها، يجب مراجعة توثيقها وطريقة معالجتها للبيانات وحدودها المعروفة، وتحديد مسؤوليات الإشراف والحوادث والتحديثات في العقد.",
    "applies_when": {
      "min_tier": "limited",
      "ai_types": [],
      "data": []
    },
    "refs": {
      "uae_charter": [],
      "uae_gov_code": [],
      "dubai_ethics": [
        "Accountability"
      ],
      "sdaia": [
        "Transparency & Explainability"
      ],
      "iso42001": [
        "A.10.2",
        "A.10.3"
      ],
      "nist_ai_rmf": [
        "GOVERN 6.1",
        "MANAGE 3.1"
      ],
      "eu_ai_act": [
        "Art. 25"
      ]
    },
    "source_urls": [
      "https://www.digitaldubai.ae/docs/default-source/ai-principles-resources/ai-ethics.pdf",
      "https://sdaia.gov.sa/en/SDAIA/about/Documents/ai-principles.pdf",
      "https://airc.nist.gov/docs/NIST_AI_RMF_to_ISO_IEC_42001_Crosswalk.pdf",
      "https://nvlpubs.nist.gov/nistpubs/ai/NIST.AI.100-1.pdf",
      "https://eur-lex.europa.eu/legal-content/EN/TXT/HTML/?uri=OJ:L_202401689"
    ],
    "verified": true,
    "verified_on": "2026-09-27",
    "notes": "ISO/IEC 42001 numbers confirmed via the NIST-hosted crosswalk, which cites the FDIS Annex B guidance numbering that parallels Annex A."
  },
  {
    "id": "CTL-ACC-07",